post_id,post_text,keywords,visual_summary,ocr_text,Harmful_Content,Political_Content,Spam,Copyright_Infringement,Is_Harmful_Content,Is_Political_Content,Is_Spam,Is_Copyright_Infringement
46971,bravery at its finest,"[""finest']"", 'finest.', 'text:', 'written', 'shows:', 'post', 'shows', ""finest'"", 'eating', 'over', 'cookie,', 'with', ""'bravery"", 'words', 'says:', 'text', 'image', ""['bravery"", 'it.""].', '[""the', 'bravery']","[""The image shows a man eating a cookie, with the words 'bravery at its finest' written over it.""]",['bravery at its finest'],-0.049053419458555916,0.24895296924249044,0.005307091044984513,0.05402857477794998,0,0,0,0
03745,your order comes to $37.50 and your white privilege discount brings the total to $37.50,"['privilege', 'pens.', 'chalkboard', 'denim', 'blue', 'brings', 'text:', 'comes', ""['your"", 'wearing', 'looking', 'mouse,', ""shelf.']."", 'shows:', 'background', 'post', 'woman', 'monitor,', 'your', ""$37.50']"", 'standing', 'blonde', 'wall', 'sweater', '$37.50', 'hair', 'apron.', 'wooden', 'with', 'long', 'camera.', 'front', 'discount', 'computer', 'says:', 'smiling', 'order', 'white', 'behind', 'text', 'image', 'counter,', 'total', '$37.50.']","['A woman with long blonde hair is standing behind a counter, wearing a white sweater and a blue denim apron. She is smiling and looking at the camera. In front of her is a computer monitor, a mouse, and a cup with pens. The background is a wall with a chalkboard and a wooden shelf.']",['your order comes to $37.50 and your white privilege discount brings the total to $37.50'],0.2298403158482205,0.7616648046587063,0.07796280495903445,0.07713605035040877,0,1,0,0
83745,it is time.. to send these parasites back to the desert,"[""['it"", 'time..', 'send', 'time', 'text:', 'dressed', 'medieval', 'shows:', 'caption', ""desert']"", 'time...', 'post', 'costume,', 'desert\'.""].', 'person', 'with', 'back', 'says:', 'holding', 'text', 'parasites', 'these', 'image', 'desert.', 'sword']","[""A person dressed in a medieval costume, holding a sword with the caption 'It is time to send these parasites back to the desert'.""]",['it is time... to send these parasites back to the desert'],0.33843798312967605,0.27924222678384325,0.2774186771868647,0.07747848934718056,0,0,0,0
05279,"knowing white people , that's probably the baby father","['horse,', 'people,', 'baby', 'father.', 'body', 'next', 'text:', '[""knowing', 'foreground', 'shows:', ""that's"", 'father""]', 'post', 'woman', 'shows', 'knowing', 'people', 'standing', 'probably', 'with', ""woman's"", 'background.""].', 'says:', 'white', 'text', 'image', 'head', 'pregnant', '[""the', ""horse's""]","[""The image shows a pregnant woman standing next to a horse, with the horse's head in the foreground and the woman's body in the background.""]","[""knowing white people, that's probably the baby father""]",0.3060587618943695,0.6955873588402651,0.03461366872061855,0.039137911638143674,0,0,0,0
01796,life hack #23 how to get stoned with no weed,"['says:', 'shows:', 'hijab', 'text', 'image', 'life', 'another', 'stoned', 'post', 'with', 'woman', ""cheek.']."", 'weed.', ""['life"", ""weed']"", 'kissing', 'text:', 'hack']",['A woman in a hijab is kissing another woman in a hijab on the cheek.'],['life hack #23 how to get stoned with no weed'],0.2273986552820404,0.6856710782228038,0.2909437751551305,0.06947341754327672,0,0,0,0
82301,cooooooooooooon!!!!,"[""['cooooooooon!!!!']"", 'says:', 'snowy', 'shows:', 'text', 'image', 'howling', 'post', 'cooooooooooooon!!!!.', 'text:', ""mountain.'].""]",['A dog is howling at the top of a snowy mountain.'],['COOOOOOOOON!!!!'],0.07262179651934403,0.7738200182742521,0.2013916514753699,0.021789683085302648,0,1,0,0
31752,when you get to choose your own mental illness,"['illness\'.""].', 'community,', 'thumbs-up', 'text:', 'shows:', 'representing', 'choose', 'post', 'your', 'rainbow-colored', ""['when"", 'when', 'illness.', 'with', 'lgbtq+', ""illness']"", 'says:', 'text', 'mental', 'image', 'stripe,', 'graphic', ""'when""]","[""A thumbs-up graphic with a rainbow-colored stripe, representing the LGBTQ+ community, and the text 'when you get to choose your own mental illness'.""]",['when you get to choose your own mental illness'],0.255665674711529,0.43844746128396606,0.25396078587933774,0.017594834543049897,0,0,0,0
